{"$schema":"https://json-schema.org/draft/2020-12/schema","$id":"https://github.com/declarative-migrations/declmig-interfaces/schema/v2/migrationplan.json","title":"MigrationPlan","description":"Closed, phase-aware migration plan contract. Cross-field semantic invariants are additionally enforced by language validators.","type":"object","additionalProperties":false,"required":["format","id","revision","engine","engine_version","source_catalog_sha256","desired_catalog_sha256","rendered_sql_sha256","phases"],"properties":{"format":{"const":"ores.migration-plan/v2"},"id":{"type":"string","minLength":1},"revision":{"type":"string","minLength":1},"engine":{"$ref":"#/$defs/DatabaseEngine"},"engine_version":{"type":"string","minLength":1},"source_catalog_sha256":{"type":"string","pattern":"^[a-f0-9]{64}$"},"desired_catalog_sha256":{"type":"string","pattern":"^[a-f0-9]{64}$"},"rendered_sql_sha256":{"type":"string","pattern":"^[a-f0-9]{64}$"},"phases":{"type":"array","minItems":1,"items":{"$ref":"#/$defs/MigrationPhase"}}},"$defs":{"DatabaseEngine":{"type":"string","enum":["postgresql","cockroachdb"]},"SafetyClass":{"type":"string","enum":["safe","online","blocking","destructive","manual_review"]},"RetryClass":{"type":"string","enum":["never","idempotent","serializable_restart","replan_required"]},"RollbackClass":{"type":"string","enum":["reversible","compensatable","restore_required","irreversible"]},"ApprovalRequirement":{"type":"string","enum":["none","operator","destructive_operator","security_review","manual"]},"LockExpectation":{"type":"string","enum":["none","metadata","share","exclusive","engine_managed"]},"ChangeKind":{"type":"string","enum":["create_schema","drop_schema","create_table","drop_table","add_column","alter_column","drop_column","add_constraint","drop_constraint","create_index","drop_index","create_view","drop_view","create_function","drop_function","data_backfill","manual"]},"CheckExpectation":{"type":"string","enum":["no_rows","boolean_true","scalar_equals"]},"MigrationChange":{"type":"object","additionalProperties":false,"required":["kind","resource","safety"],"properties":{"kind":{"$ref":"#/$defs/ChangeKind"},"resource":{"type":"string","minLength":1},"safety":{"$ref":"#/$defs/SafetyClass"},"manual_reason":{"type":"string","minLength":1}},"allOf":[{"if":{"properties":{"safety":{"const":"manual_review"}},"required":["safety"]},"then":{"required":["manual_reason"]}}]},"PhaseMetadata":{"type":"object","additionalProperties":false,"required":["id","safety","retry","rollback","approval","timeout_seconds","lock_expectation","changes"],"properties":{"id":{"type":"string","minLength":1},"safety":{"$ref":"#/$defs/SafetyClass"},"retry":{"$ref":"#/$defs/RetryClass"},"rollback":{"$ref":"#/$defs/RollbackClass"},"approval":{"$ref":"#/$defs/ApprovalRequirement"},"timeout_seconds":{"type":"integer","minimum":1,"maximum":4294967295},"lock_expectation":{"$ref":"#/$defs/LockExpectation"},"changes":{"type":"array","minItems":1,"items":{"$ref":"#/$defs/MigrationChange"}}}},"MigrationStatement":{"type":"object","additionalProperties":false,"required":["ordinal","sql","sha256"],"properties":{"ordinal":{"type":"integer","minimum":1,"maximum":4294967295},"sql":{"type":"string","minLength":1},"sha256":{"type":"string","pattern":"^[a-f0-9]{64}$"}}},"MigrationCheck":{"type":"object","additionalProperties":false,"required":["name","sql","expectation"],"properties":{"name":{"type":"string","minLength":1},"sql":{"type":"string","minLength":1},"expectation":{"$ref":"#/$defs/CheckExpectation"},"expected_value":{"type":"string"}},"allOf":[{"if":{"properties":{"expectation":{"const":"scalar_equals"}},"required":["expectation"]},"then":{"required":["expected_value"]},"else":{"not":{"required":["expected_value"]}}}]},"TransactionalDdlPhase":{"type":"object","additionalProperties":false,"required":["kind","metadata","statements","preconditions","postconditions"],"properties":{"kind":{"const":"transactional_ddl"},"metadata":{"$ref":"#/$defs/PhaseMetadata"},"statements":{"type":"array","minItems":1,"items":{"$ref":"#/$defs/MigrationStatement"}},"preconditions":{"type":"array","items":{"$ref":"#/$defs/MigrationCheck"}},"postconditions":{"type":"array","items":{"$ref":"#/$defs/MigrationCheck"}}}},"NonTransactionalDdlPhase":{"type":"object","additionalProperties":false,"required":["kind","metadata","statements","cleanup_on_failure","preconditions","postconditions"],"properties":{"kind":{"const":"non_transactional_ddl"},"metadata":{"$ref":"#/$defs/PhaseMetadata"},"statements":{"type":"array","minItems":1,"items":{"$ref":"#/$defs/MigrationStatement"}},"cleanup_on_failure":{"type":"string","minLength":1},"preconditions":{"type":"array","items":{"$ref":"#/$defs/MigrationCheck"}},"postconditions":{"type":"array","items":{"$ref":"#/$defs/MigrationCheck"}}}},"CockroachSchemaJobPhase":{"type":"object","additionalProperties":false,"required":["kind","metadata","statements","wait_for_terminal_jobs","preconditions","postconditions"],"properties":{"kind":{"const":"cockroach_schema_job"},"metadata":{"$ref":"#/$defs/PhaseMetadata"},"statements":{"type":"array","minItems":1,"items":{"$ref":"#/$defs/MigrationStatement"}},"wait_for_terminal_jobs":{"type":"boolean"},"preconditions":{"type":"array","items":{"$ref":"#/$defs/MigrationCheck"}},"postconditions":{"type":"array","items":{"$ref":"#/$defs/MigrationCheck"}}}},"DataBackfillPhase":{"type":"object","additionalProperties":false,"required":["kind","metadata","worker_artifact_sha256","batch_key","max_batch_size","preconditions","postconditions"],"properties":{"kind":{"const":"data_backfill"},"metadata":{"$ref":"#/$defs/PhaseMetadata"},"worker_artifact_sha256":{"type":"string","pattern":"^[a-f0-9]{64}$"},"batch_key":{"type":"string","minLength":1},"max_batch_size":{"type":"integer","minimum":1,"maximum":4294967295},"preconditions":{"type":"array","items":{"$ref":"#/$defs/MigrationCheck"}},"postconditions":{"type":"array","minItems":1,"items":{"$ref":"#/$defs/MigrationCheck"}}}},"ValidationPhase":{"type":"object","additionalProperties":false,"required":["kind","metadata","checks"],"properties":{"kind":{"const":"validation"},"metadata":{"$ref":"#/$defs/PhaseMetadata"},"checks":{"type":"array","minItems":1,"items":{"$ref":"#/$defs/MigrationCheck"}}}},"TrafficTransitionPhase":{"type":"object","additionalProperties":false,"required":["kind","metadata","deployment_gate"],"properties":{"kind":{"const":"traffic_transition"},"metadata":{"$ref":"#/$defs/PhaseMetadata"},"deployment_gate":{"type":"string","minLength":1}}},"DestructiveCleanupPhase":{"type":"object","additionalProperties":false,"required":["kind","metadata","statements","backup_requirement","preconditions","postconditions"],"properties":{"kind":{"const":"destructive_cleanup"},"metadata":{"$ref":"#/$defs/PhaseMetadata"},"statements":{"type":"array","minItems":1,"items":{"$ref":"#/$defs/MigrationStatement"}},"backup_requirement":{"type":"string","minLength":1},"preconditions":{"type":"array","items":{"$ref":"#/$defs/MigrationCheck"}},"postconditions":{"type":"array","items":{"$ref":"#/$defs/MigrationCheck"}}}},"MigrationPhase":{"oneOf":[{"$ref":"#/$defs/TransactionalDdlPhase"},{"$ref":"#/$defs/NonTransactionalDdlPhase"},{"$ref":"#/$defs/CockroachSchemaJobPhase"},{"$ref":"#/$defs/DataBackfillPhase"},{"$ref":"#/$defs/ValidationPhase"},{"$ref":"#/$defs/TrafficTransitionPhase"},{"$ref":"#/$defs/DestructiveCleanupPhase"}]}}}
